{
  "case_schema": "conformance/al2-vate-v0.3/conformance-case.schema.json",
  "cases": [
    {
      "artifacts": {
        "admission_receipt": "examples/receipts/admission-allow-a2a-signed-agent-card.example.json",
        "detached_payload": "examples/a2a/agent-card-v1-vate-extension.example.json",
        "jose_proof": "examples/jose/jose-detached-a2a-agent-card.example.json",
        "trust_bundle": "examples/trust-bundle-agent-card.example.json"
      },
      "case_id": "allow-a2a-signed-agent-card-evidence",
      "category": "positive",
      "expected_outcome": "allow",
      "expected_primary_reason_code": "EVIDENCE_VERIFIED",
      "expected_reason_codes": [
        "EVIDENCE_VERIFIED",
        "POLICY_MATCH"
      ],
      "expected_should_execute": true,
      "path": "conformance/al2-vate-v0.3/cases/allow-a2a-signed-agent-card-evidence.json",
      "title": "Allow byte-bound A2A signed Agent Card evidence",
      "validation_focus": [
        "A2A signed Agent Card",
        "detached JWS fixture",
        "byte-level payload binding",
        "trust bundle"
      ]
    },
    {
      "artifacts": {
        "admission_receipt": "examples/interop/ap2-human-not-present-to-vate/vate-admission-receipt-ap2-hnp-valid.example.json",
        "admission_request": "examples/interop/ap2-human-not-present-to-vate/vate-admission-request-ap2-hnp-valid.example.json",
        "ap2_mandate": "examples/interop/ap2-human-not-present-to-vate/ap2-hnp-mandate-valid.example.json"
      },
      "case_id": "allow-ap2-hnp-preauthorized-mandate",
      "category": "positive",
      "expected_outcome": "allow",
      "expected_primary_reason_code": "EVIDENCE_VERIFIED",
      "expected_reason_codes": [
        "EVIDENCE_VERIFIED",
        "POLICY_MATCH"
      ],
      "expected_should_execute": true,
      "path": "conformance/al2-vate-v0.3/cases/allow-ap2-hnp-preauthorized-mandate.json",
      "title": "Allow a pre-authorized AP2 Human Not Present mandate",
      "validation_focus": [
        "AP2 Human Not Present",
        "payment authority evidence",
        "bounded delegated commerce"
      ]
    },
    {
      "artifacts": {
        "admission_receipt": "examples/receipts/admission-allow.example.json",
        "detached_payload": "examples/jose/detached-runtime-attestation-payload.json",
        "jose_proof": "examples/jose/jose-detached-runtime-attestation-valid.example.json",
        "trust_bundle": "examples/trust-bundle.example.json"
      },
      "case_id": "allow-jose-detached-runtime-attestation",
      "category": "positive",
      "expected_outcome": "allow",
      "expected_primary_reason_code": "EVIDENCE_VERIFIED",
      "expected_reason_codes": [
        "EVIDENCE_VERIFIED",
        "POLICY_MATCH"
      ],
      "expected_should_execute": true,
      "path": "conformance/al2-vate-v0.3/cases/allow-jose-detached-runtime-attestation.json",
      "title": "Allow byte-bound detached JWS runtime attestation fixture",
      "validation_focus": [
        "detached JWS fixture",
        "byte-level payload binding",
        "trust bundle"
      ]
    },
    {
      "artifacts": {
        "admission_receipt": "examples/receipts/admission-allow-mcp-oauth-token-authority-bound.example.json",
        "admission_request": "examples/transport/mcp-oauth-token-authority-bound-admission-request.example.json"
      },
      "case_id": "allow-mcp-oauth-token-authority-bound",
      "category": "positive",
      "expected_outcome": "allow",
      "expected_primary_reason_code": "EVIDENCE_VERIFIED",
      "expected_reason_codes": [
        "EVIDENCE_VERIFIED",
        "POLICY_MATCH"
      ],
      "expected_should_execute": true,
      "pairing": {
        "mutated_fields": [
          "constraints.transport.oauth.upstream_authorization",
          "constraints.transport.oauth.resource_binding"
        ],
        "mutation_axis": "oauth_authority_binding",
        "pair_id": "mcp-oauth-token-authority",
        "paired_case_id": "deny-token-passthrough-as-authority",
        "role": "positive",
        "stable_fields": [
          "actor",
          "principal",
          "runtime",
          "audience",
          "action",
          "target.resource",
          "target.audience",
          "requested_tool",
          "requested_tool_class",
          "constraints.expected_runtime",
          "constraints.transport.oauth.issuer",
          "constraints.transport.oauth.audience",
          "constraints.transport.oauth.resource",
          "constraints.transport.oauth.protected_resource",
          "constraints.transport.oauth.token_present",
          "constraints.transport.oauth.token_kind",
          "constraints.transport.oauth.required_scope",
          "constraints.transport.oauth.scopes",
          "constraints.transport.oauth.proof_of_possession",
          "constraints.transport.mcp.authorized_tool",
          "constraints.transport.mcp.authorized_tool_class",
          "constraints.transport.mcp.requested_tool",
          "constraints.transport.mcp.requested_tool_class",
          "policy.policy_id",
          "issued_at",
          "expires_at"
        ]
      },
      "path": "conformance/al2-vate-v0.3/cases/allow-mcp-oauth-token-authority-bound.json",
      "title": "Allow token evidence with matched upstream authority",
      "validation_focus": [
        "MCP transport binding",
        "OAuth authority intersection",
        "resource binding",
        "positive control"
      ]
    },
    {
      "artifacts": {
        "admission_receipt": "examples/receipts/admission-allow-mcp-oauth-bound.example.json",
        "admission_request": "examples/transport/mcp-oauth-admission-request.example.json"
      },
      "case_id": "allow-mcp-oauth-transport-bound",
      "category": "positive",
      "expected_outcome": "allow",
      "expected_primary_reason_code": "EVIDENCE_VERIFIED",
      "expected_reason_codes": [
        "EVIDENCE_VERIFIED",
        "POLICY_MATCH"
      ],
      "expected_should_execute": true,
      "path": "conformance/al2-vate-v0.3/cases/allow-mcp-oauth-transport-bound.json",
      "title": "Allow an MCP OAuth-bound tool invocation",
      "validation_focus": [
        "MCP transport binding",
        "OAuth audience binding",
        "OpenID subject binding",
        "runtime binding"
      ]
    },
    {
      "artifacts": {
        "admission_receipt": "examples/receipts/admission-allow-mcp-oauth-tool-class-aligned.example.json",
        "admission_request": "examples/transport/mcp-oauth-tool-class-aligned-admission-request.example.json"
      },
      "case_id": "allow-mcp-tool-class-aligned",
      "category": "positive",
      "expected_outcome": "allow",
      "expected_primary_reason_code": "EVIDENCE_VERIFIED",
      "expected_reason_codes": [
        "EVIDENCE_VERIFIED",
        "POLICY_MATCH"
      ],
      "expected_should_execute": true,
      "pairing": {
        "mutated_fields": [
          "constraints.transport.mcp.authorized_tool_class"
        ],
        "mutation_axis": "mcp_tool_class_binding",
        "pair_id": "mcp-oauth-tool-class",
        "paired_case_id": "deny-mcp-tool-class-mismatch",
        "role": "positive",
        "stable_fields": [
          "actor",
          "principal",
          "runtime",
          "audience",
          "action",
          "target.resource",
          "target.audience",
          "requested_tool",
          "requested_tool_class",
          "constraints.expected_runtime",
          "constraints.transport.oauth.issuer",
          "constraints.transport.oauth.audience",
          "constraints.transport.oauth.resource",
          "constraints.transport.oauth.required_scope",
          "constraints.transport.oauth.scopes",
          "constraints.transport.oauth.proof_of_possession",
          "constraints.transport.mcp.authorized_tool",
          "constraints.transport.mcp.requested_tool",
          "constraints.transport.mcp.requested_tool_class",
          "policy.policy_id",
          "issued_at",
          "expires_at"
        ]
      },
      "path": "conformance/al2-vate-v0.3/cases/allow-mcp-tool-class-aligned.json",
      "title": "Allow aligned MCP tool class",
      "validation_focus": [
        "MCP tool class binding",
        "OAuth scope boundary",
        "positive control"
      ]
    },
    {
      "artifacts": {
        "admission_receipt": "examples/receipts/admission-allow-replay-unused.example.json",
        "replay_context": "conformance/al2-vate-v0.3/fixtures/replay-unused-context.json"
      },
      "case_id": "allow-replay-state-unused",
      "category": "positive",
      "expected_outcome": "allow",
      "expected_primary_reason_code": "EVIDENCE_VERIFIED",
      "expected_reason_codes": [
        "EVIDENCE_VERIFIED",
        "POLICY_MATCH"
      ],
      "expected_should_execute": true,
      "path": "conformance/al2-vate-v0.3/cases/allow-replay-state-unused.json",
      "title": "Allow an unused replay key",
      "validation_focus": [
        "replay detection",
        "one-time use",
        "allow decision"
      ]
    },
    {
      "artifacts": {
        "admission_receipt": "examples/receipts/admission-allow-mcp-oauth-resource-indicator-aligned.example.json",
        "admission_request": "examples/transport/mcp-oauth-resource-indicator-aligned-admission-request.example.json"
      },
      "case_id": "allow-resource-indicator-aligned",
      "category": "positive",
      "expected_outcome": "allow",
      "expected_primary_reason_code": "EVIDENCE_VERIFIED",
      "expected_reason_codes": [
        "EVIDENCE_VERIFIED",
        "POLICY_MATCH"
      ],
      "expected_should_execute": true,
      "pairing": {
        "mutated_fields": [
          "constraints.transport.oauth.resource",
          "constraints.transport.oauth.protected_resource",
          "constraints.transport.oauth.resource_binding"
        ],
        "mutation_axis": "oauth_resource_indicator_binding",